1,"Account Manager","Gerente de cuentas","FI","Los gerentes de cuentas trabajan en bancos y otras instituciones financieras para satisfacer las necesidades bancarias de los clientes."
2,"Activist","Activista","FI","Los activistas crean conciencia sobre cuestiones sociales, políticas o ambientales, y trabajan para generar cambios."
3,"Actor","Actor","FI","Los actores trabajan en obras, películas, programas de televisión, comerciales y otras producciones."
4,"Actuary","Actuario","FI","Los actuarios determinan cuánto cobrar por servicios que tienen un costo futuro incierto, como los seguros."
5,"Acupuncturist","Acupuntor","HE","Los acupuntores tratan enfermedades mediante la colocación de agujas en puntos específicos de la superficie del cuerpo para aliviar el dolor y el estrés de los pacientes."
6,"Addictions Counselor","Consejero en adicciones","HS","Los consejeros en adicciones ayudan a las personas a superar su dependencia del alcohol, las drogas, el juego y otras adicciones."
7,"Administrative Assistant","Auxiliar administrativo","HS","Los auxiliares administrativos llevan a cabo las tareas necesarias para que las organizaciones continúen funcionando correctamente."
8,"Advertising Account Executive","Ejecutivo de cuentas publicitarias","BU,MK","Los ejecutivos de cuentas publicitarias trabajan con los clientes y coordinan las actividades de las personas que desarrollan campañas publicitarias."
9,"Advertising Copywriter","Redactor publicitario","AR,BU,MK","Los redactores publicitarios crean anuncios para periódicos, revistas, programas de televisión, radio e Internet."
10,"Aerospace Engineer","Ingeniero aeroespacial","SC","Los ingenieros aeroespaciales diseñan, construyen y ponen a prueba aviones, naves espaciales y misiles."
11,"Agent","Representante","BU,MK","Los representantes defienden los intereses financieros y profesionales de sus clientes, incluidos atletas, modelos, escritores y actores."
13,"Agronomist","Agrónomo","AG,SC","Los agrónomos estudian las plantas y el suelo para ayudar a los granjeros a producir grandes extensiones de cultivos sanos."
14,"Air Traffic Controller","Controlador aéreo","AG,SC","Los controladores aéreos dirigen los horarios de despegue y aterrizaje de los aviones y las rutas de vuelo mientras están en el aire."
15,"Aircraft Mechanic","Mecánico de aviones","AG,SC","Los mecánicos de aviones mantienen los aviones en vuelo realizando tareas de mantenimiento, reparación e inspecciones regulares."
16,"Airport Ground Crew","Personal aeronáutico de tierra","AG,SC","El personal aeronáutico de tierra se encarga del mantenimiento de los aviones cuando están en tierra; carga mercadería e inspecciona, abastece de combustible y dirige los aviones."
17,"Animal Breeder","Criador de animales","AG,SC","Los criadores de animales crían y venden perros, gatos, caballos, pájaros y otros animales."
18,"Animal Caretaker","Cuidador de animales","AG,SC","Los cuidadores de animales se ocupan de los animales dondequiera que estos se encuentren: criaderos, tiendas de mascotas y zoológicos."
19,"Animal Trainer","Adiestrador de animales","AG,SC","Los adiestradores de animales adiestran perros, caballos, ballenas y otros ejemplares para que sean obedientes, sigan órdenes y se comporten de la forma deseada."
20,"Animator","Creador de animaciones","AR","Los creadores de animaciones dibujan series de imágenes que se filman, para crear dibujos animados para cine y televisión."
21,"Announcer","Locutor","AR","Los locutores presentan los datos del clima, los deportes y otras historias de interés periodístico en la televisión o la radio."
22,"Anthropologist","Antropólogo","AR,SC","Los antropólogos estudian a los seres humanos: nuestra evolución y características físicas, nuestras culturas y sociedades, y nuestras lenguas."
23,"Antique Dealer","Anticuario","AR,SC","Los anticuarios compran y venden antigüedades con el fin de ganar dinero."
24,"Appliance Repairer","Electricista","AR,SC","Los electricistas diagnostican y solucionan problemas relacionados con los electrodomésticos, como los hornos, las máquinas de lavar, los secadores y las aspiradoras."
25,"Appraiser","Tasador","MK","Los tasadores calculan el valor de diferentes tipos de bienes, como joyas, viviendas y maquinarias."
26,"Aquaculturist","Acuicultor","AG","Los acuicultores crían, cultivan y venden peces, mariscos, algas y otros animales y plantas que viven en el agua."
27,"Arborist","Arborista","AG","Los arboristas se ocupan de plantar y cuidar árboles en bosques, ciudades, parques y en cualquier otro lugar donde crezcan."
28,"Archaeologist","Arqueólogo","AR,SC","Los arqueólogos desentierran, preservan y estudian objetos artesanales para aprender sobre las civilizaciones pasadas."
29,"Architect","Arquitecto","AC","Los arquitectos planifican y diseñan edificios, como viviendas, escuelas, torres de oficinas y otras estructuras."
31,"Archivist","Archivista","AC","Los archivistas recopilan y organizan registros históricos, como documentos del gobierno, periódicos, diarios personales, cartas y fotografías."
32,"Art / Music Therapist","Arteterapeuta/Musicoterapeuta","AR,HE","Los arteterapeutas y los musicoterapeutas recurren al arte o la música para ayudar a los pacientes a expresarse y a afrontar problemas físicos y emocionales."
34,"Art Director","Director artístico","AR,MK","Los directores artísticos son los encargados de la imagen general de las películas, los programas de televisión, las producciones teatrales, las revistas, los periódicos, los anuncios y los productos multimedia."
35,"Conservator","Curador de arte","AR,HT,SC","Los curadores de arte preservan y restauran objetos de valor, entre ellos, pinturas, libros, cerámicas, telas y fotografías."
36,"Artist","Artista","AR","Los artistas se expresan a través de la pintura, el dibujo, la escultura y otros tipos de arte."
37,"Arts Administrator","Administrador de actividades artísticas","AR,BU","Los administradores de actividades artísticas planifican, organizan y administran programas y actividades artísticas, como producciones teatrales o exposiciones de arte."
38,"Astronaut","Astronauta","SC","Los astronautas son científicos, ingenieros y otros expertos con mucho entrenamiento que vuelan más allá de la atmósfera terrestre en transbordadores espaciales."
39,"Astronomer","Astrónomo","SC","Los astrónomos estudian las estrellas, los planetas, los meteoros y los cometas a fin de comprender el origen, la estructura y la evolución del universo."
40,"Athletic Trainer","Entrenador deportivo","ED,HE","Los entrenadores deportivos les enseñan a los deportistas a evitar y tratar lesiones y, de esta manera, los ayudan a mantenerse saludables."
41,"Auctioneer","Subastador","ED,HE","Los subastadores se ocupan de vender todo tipo de artículos en subastas, entre los que se incluyen joyas, obras de arte, bienes inmuebles y ganado."
42,"Audiologist","Audiólogo","ED,HE","Los audiólogos ayudan a las personas con deficiencias auditivas mediante el diagnóstico de problemas auditivos y la indicación de tratamiento o rehabilitación."
43,"Autobody Repairer","Reparador de carrocerías","ED,HE","Los reparadores de carrocerías arreglan los daños ocasionados en la carrocería de los vehículos enderezando los marcos doblados, eliminando abolladuras y reemplazando las piezas abolladas."
44,"Automobile Assembler","Operario de línea de montaje de automóviles","ED,HE","Los operarios de línea de montaje de automóviles instalan piezas y componentes previamente producidos para fabricar vehículos nuevos."
45,"Automotive Service Technician","Técnico en servicio automotor","ED,HE","Los técnicos en servicio automotor mantienen y reparan vehículos."
46,"Automobile Salesperson","Vendedor de automóviles","ED,HE","Los vendedores de automóviles venden automóviles, camiones, motocicletas y otros vehículos nuevos y usados."
47,"Avionics Tech","Técnico en aviónica","ED,HE","Los técnicos en aviónica prueban, reparan y mantienen sistemas electrónicos y equipos que se usan en todas las aeronaves."
49,"Baker","Panadero","ED,HE","Los panaderos elaboran tortas, galletas dulces, panes, pasteles y otros productos horneados."
50,"Bank Manager","Gerente de banco","FI","Los gerentes de banco son responsables de todo lo que sucede en la sucursal bancaria que dirigen."
51,"Bank Teller","Cajero de banco","FI","Los cajeros de los bancos atienden a los clientes en las transacciones de mostrador."
52,"Bartender","Barman","FI","Los bármanes preparan y sirven tragos a los clientes, y se aseguran de que se respeten las leyes que regulan la venta y el consumo de bebidas alcohólicas."
53,"Bed and Breakfast Proprietor","Propietario de Hospedaje, Bed and Breakfast","FI","Los propietarios de los hospedajes tipo ""Bed and Breakfast"", ofrecen alojamiento y desayuno a los viajeros en casas comunes de las cuales son dueños."
54,"Beekeeper","Apicultor","FI","Los apicultores cuidan las poblaciones de abejas con el fin de recolectar la miel que estas producen y mantener polinizados los cultivos de los granjeros."
55,"Bicycle Mechanic","Mecánico de bicicletas","FI","Los mecánicos de bicicletas ponen a punto y reparar bicicletas viejas o averiadas"
56,"Biological Tech","Técnico biólogo","FI","Los técnicos biólogos ayudan a los científicos, los médicos y los ingenieros mediante la realización de pruebas de laboratorio e investigación de campo."
57,"Biologist","Biólogo","AG,HE,SC","Los biólogos estudian todos los seres vivientes (plantas, animales y seres humanos) y los ambientes que estos habitan."
58,"Boilermaker","Fabricante de calderas","AG,HE,SC","Los fabricantes de calderas arman, instalan y reparan las calderas que suministran el vapor utilizado para generar electricidad o para proporcionar calor a los edificios."
59,"Bookbinder","Encuadernador","AG,HE,SC","Los encuadernadores arman, cortan y pliegan hojas impresas, y luego las pegan, cosen o engrapan para hacer libros."
60,"Bookkeeper","Auxiliar contable","AG,HE,SC","Los auxiliares contables llevan un control de la cantidad de dinero que recibe y gasta una compañía."
61,"Botanist","Botánico","AG,SC","Los botánicos son científicos en biología que estudian las plantas."
62,"Brewmaster","Maestro cervecero","AG,SC","Los maestros cerveceros supervisan la producción de cerveza en fábricas de cerveza."
63,"Bricklayer / Stonemason","Albañil/Mampostero","AG,SC","Los albañiles construyen casas y otras estructuras apilando ladrillos, piedras o bloques de hormigón."
64,"Broadcast Technician","Técnico de radio y televisión","AG,SC","Los técnicos en radio y televisión montan, operan y se encargan del mantenimiento del equipo utilizado para grabar y transmitir programas de radio y televisión."
65,"Construction Manager","Gerente de construcción","AC,BU","Los gerentes de construcción planifican y supervisan la construcción de todo tipo de estructuras, entre las que se incluyen rascacielos, viviendas, caminos y puentes."
66,"Building Inspector","Inspector de edificios","AC,BU","Los inspectores de edificios se aseguran de que todo edificio, tanto nuevo como antiguo, cumpla con los códigos de construcción y de seguridad."
67,"Building Superintendent","Conserje de edificio","AC,BU","Los conserjes de edificios se ocupan del mantenimiento de edificios comerciales y residenciales, y en general de todo tipo de edificios."
68,"Bus Driver","Conductor de autobús","AC,BU","Los conductores de autobuses transportan pasajeros en autobuses escolares, turísticos y urbanos."
69,"Business Systems Analyst","Analista de sistemas de negocios","BU,IT","Los analistas de sistemas de negocios investigan, diseñan y crean sistemas informáticos para comercios."
70,"Butcher","Carnicero","BU,IT","Los carniceros preparan cortes de carne de vaca, cerdo, pollo, cordero y de otros animales para que la gente pueda comerlos."
71,"Cabinetmaker","Ebanista","BU,IT","Los ebanistas construyen y reparan muebles de madera y otros materiales."
72,"Cable Installer and Repairer","Instalador y reparador de cable","BU,IT","Los instaladores y reparadores de cable instalan y reparan las líneas y los equipos que permiten las transmisiones por Internet y de televisión por cable."
73,"Camera Operator","Operador de cámara","BU,IT","Los operadores de cámaras combinan la capacidad técnica y la creatividad artística para filmar programas de televisión, películas, comerciales y documentales."
74,"Cardiovascular Tech","Técnico cardiovascular","BU,IT","Los técnicos cardiovasculares ayudan a los médicos a diagnosticar y tratar a los pacientes con problemas cardíacos y de los vasos sanguíneos."
75,"Career Counselor","Consejero vocacional","ED,HS","Los consejeros vocacionales ayudan a los clientes a fijarse y trabajar en pos de metas profesionales que reflejen mejor su situación y sus cualidades personales."
76,"Carpenter","Carpintero","ED,HS","Los carpinteros construyen las estructuras de soporte de madera para edificios y colocan accesorios finales, como gabinetes, puertas y escaleras."
77,"Carpet and Upholstery Cleaner","Limpiador de alfombras y tapizados","ED,HS","Los limpiadores de alfombras y tapizados emplean equipos especiales de limpieza para eliminar la suciedad y las manchas de tapetes, alfombras y muebles cubiertos en tela."
78,"Cartographer","Cartógrafo","AG,SC","Los cartógrafos miden, exploran y trazan los mapas de la superficie de la tierra."
79,"Cartoonist / Comic Illustrator","Caricaturista/Dibujante de historietas","AR","Los caricaturistas dibujan historietas y tiras cómicas para entretener, hacer publicidad o educar."
80,"Cashier","Cajero","AR","Los cajeros usan cajas registradoras para calcular el total de las cuentas de los clientes, reciben los pagos y dan cambio."
81,"Casting Director","Director de reparto","AR","Los directores de reparto buscan a personas talentosas para todo tipo de producciones, incluidas películas, comerciales de radio y obras de teatro."
82,"Caterer","Proveedor de servicios alimenticios","HT","Los proveedores de servicios alimenticios supervisan la preparación y el servicio de comidas en casamientos, fiestas y otros eventos especiales."
86,"Chef","Chef","HT","Los chefs elaboran platos y coordinan las actividades de la cocina en restaurantes, hoteles y otras instalaciones."
87,"Chemical Engineering Tech","Técnico en ingeniería química","HT","Los técnicos en ingeniería química ayudan a los ingenieros a diseñar y operar equipos y procesos que generan cambios en la materia física."
88,"Chemical Engineer","Ingeniero químico","SC","Los ingenieros químicos diseñan y operan equipos y procesos que generan cambios en la materia física (sólidos, líquidos y gases)."
89,"Chemist","Químico","SC","Los químicos son científicos que estudian los productos químicos y cómo interactúan entre sí."
90,"Child and Youth Worker","Asistente de minoridad","HS,LA","Los asistentes de minoridad brindan ayuda y orientación a niños y adolescentes con problemas emocionales, conductuales y de desarrollo."
91,"Chimney Sweep","Deshollinador de chimeneas","HS,LA","Los deshollinadores de chimeneas limpian y se ocupan del mantenimiento de chimeneas y sistemas de calefacción."
93,"Chiropractor","Quiropráctico","HE","Los quiroprácticos diagnostican y tratan trastornos relacionados con la columna vertebral y otras articulaciones, que incluyen dolores de espalda, de cuello y de cabeza."
94,"Circus Performer","Artista de circo","HE","Los artistas de circo entretienen al público con magia, juegos de malabares, acrobacias y otros números de circo."
95,"Civil Engineer","Ingeniero civil","AC,AG,SC,TR","Los ingenieros civiles colaboran en el diseño y la construcción de las estructuras que nos rodean, que incluyen edificios, puentes, represas, autopistas, ferrocarriles y cloacas."
96,"Civil Engineering Tech","Técnico en ingeniería civil","AC,AG,SC,TR","Los técnicos en ingeniería civil ayudan a los ingenieros civiles a desarrollar, diseñar y construir todo tipo de estructura desde casas hasta estadios."
97,"Civil Litigator","Litigante civil","LA","Los litigantes civiles son abogados que manejan los conflictos legales entre personas o empresas."
98,"Clergy","Clérigo","LA","Los clérigos son líderes espirituales que ofician ritos y servicios religiosos, guían a los fieles y promueven la fe."
99,"Clothing Manufacturer","Fabricante de ropa","LA","Los fabricantes de ropa dirigen las compañías que producen camisas, sacos, pantalones, cinturones y muchas otras cosas que usamos para vestirnos."
100,"Coast Guard","Guardacostas","LA","Los guardacostas patrullan nuestros océanos, lagos y ríos para que sean lugares seguros."
101,"Comedian","Comediante","LA","Los comediantes cuentan chistes, historias divertidas, realizan escenas de riesgo físico y hacen comedia para que la gente se ría."
103,"Community Worker","Asistente social","HS","Los asistentes sociales trabajan en programas de asistencia y servicio social a la comunidad que ayudan a las personas que lo necesitan."
104,"Composer","Compositor","AR","Los compositores crean música original, desde sinfonías y óperas hasta canciones de música pop."
105,"Computer Animator","Creador de animaciones computarizadas","AR,IT","Los creadores de animaciones computarizadas emplean tecnología de computación a fin de crear gráficos dinámicos para películas, espectáculos televisivos, videojuegos y otros proyectos."
107,"Computer Network Specialist","Especialista en redes informáticas","IT","Los especialistas en redes informáticas desarrollan, instalan y se ocupan del mantenimiento de las redes informáticas que conectan las computadoras entre sí."
108,"Computer Programmer","Programador de computadoras","IT","Los programadores de computadoras escriben, ponen a prueba, desarrollan y actualizan programas de software informático."
109,"Computer Support Person","Responsable de soporte informático","IT","Los responsables de soporte informático para computadoras se ocupan de la configuración, el mantenimiento y la reparación de sistemas informáticos."
110,"Computer Trainer","Instructor en informática","BU,ED,IT","Los instructores en informática enseñan a las personas a usar sistemas informáticos."
111,"Concrete Mason","Albañil especialista en hormigón","BU,ED,IT","Los albañiles especialistas en hormigón mezclan, vierten y alisan el hormigón que se utiliza para construir desde rascacielos hasta entradas para automóviles."
112,"Conservation Officer","Funcionario de servicios de conservación","AG,GO,LA","Los funcionarios de servicios de conservación patrullan y protegen parques y áreas naturales, y se aseguran de que nadie dañe el ambiente ni la flora y la fauna."
113,"Construction Tradesperson","Trabajador de la construcción","AG,GO,LA","Los trabajadores de la construcción trabajan como parte de un equipo y construyen desde casas hasta rascacielos."
114,"Convenience Store Operator","Empleado de minimercado","AG,GO,LA","Los empleados de minimercados venden productos a clientes y atienden minimercados."
115,"Cook","Cocinero","AG,GO,LA","Los cocineros elaboran platos en restaurantes, hoteles, escuelas, hospitales y otras instalaciones."
116,"Corporate / Commercial Lawyer","Abogado mercantil/comercial","LA","Los abogados comerciales se ocupan del aspecto legal de las operaciones y transacciones comerciales."
117,"Corporate Trainer","Instructor empresarial","BU,ED","Los instructores empresariales desarrollan y dictan cursos que les permiten a los empleados de la compañía mejorar sus aptitudes para el trabajo."
118,"Correctional Officer","Funcionario penitenciario","BU,ED","Los funcionarios penitenciarios supervisan y controlan a los reclusos, y así mantienen el orden en cárceles y prisiones."
119,"Costume Designer","Diseñador de vestuario","AR","Los diseñadores de vestuario trabajan en cada una de las etapas de la creación del vestuario para producciones tales como programas de televisión y obras de teatro."
120,"Courier / Messenger","Mensajero/Empleado de servicios de mensajería","AR","Los mensajeros entregan paquetes, documentos, cartas y otros artículos que se deben enviar rápidamente o entregar en mano."
121,"Court Clerk","Asistente judicial","AR","Los asistentes judiciales brindan apoyo administrativo en los juzgados; entre otras tareas, preparan los casos que irán a audiencia para garantizar que no haya inconvenientes."
122,"Craftsperson","Artesano","AR","Los artesanos diseñan y crean muchos tipos diferentes de artesanías y objetos, entre ellos, suéteres tejidos a mano, vajilla de arcilla y diseños en vitral."
123,"Crane Operator","Operador de grúas","AR","Los operarios de grúas controlan las máquinas que levantan objetos pesados o difíciles de manejar, y las desplazan adonde sea necesario."
124,"Criminal Lawyer","Abogado penalista","LA","Los abogados penalistas defienden o procesan a los acusados de delitos graves, como asesinatos, robos, agresiones o fraude."
125,"Criminologist","Criminólogo","GO,HS,LA","Los criminólogos estudian estadísticas de delitos para entender las causas y los efectos del acto criminal."
126,"Curator","Curador","AR,HT","Los curadores tienen a su cargo colecciones de arte y otros objetos, como gemas, insectos, artesanías y prendas históricas."
127,"Custodian","Conserje","AR,HT","Los conserjes se ocupan de la limpieza y el mantenimiento de escuelas, edificios de oficinas, hospitales y otros tipos de edificios."
128,"Customs Broker","Agente aduanero","BU,TR","Los agentes aduaneros ayudan a los clientes a comprender y transitar las normas y las regulaciones relacionadas con la entrada y salida de mercaderías del país."
130,"Dancer","Bailarín/Bailarina","BU,TR","Los bailarines transmiten historias, y expresan ideas, estados de ánimo y sentimientos al público a través del baile."
131,"Data Entry Clerk","Asistente a cargo del procesamiento de datos","BU,TR","Los asistentes a cargo del procesamiento de datos ingresan el texto y los datos de documentos en archivos electrónicos, hojas de cálculo o bases de datos."
132,"Database Developer","Desarrollador de bases de datos","IT","Los desarrolladores de bases de datos diseñan, instalan, actualizan y realizan el mantenimiento de sistemas informáticos que recopilan y organizan datos."
133,"Early Childhood Educator","Educador infantil","ED,HS","Los educadores infantiles cuidan y dan clases a bebés, niños pequeños y niños de preescolar."
134,"Dental Assistant","Asistente dental","ED,HS","Los asistentes dentales ayudan a los dentistas en el tratamiento de los pacientes."
135,"Dental Hygienist","Higienista dental","HE","Los higienistas dentales ayudan a mantener la salud dental de sus pacientes y les enseñan una higiene bucal adecuada."
136,"Dental Lab Tech","Técnico de laboratorio dental","HE","Los técnicos de laboratorio dental hacen y reparan aparatos dentales, como coronas, puentes y dentaduras."
137,"Dentist","Dentista","HE","Los dentistas ayudan a mantener y mejorar el aspecto y la salud de las piezas dentales de los pacientes."
139,"Desktop Publisher","Autoeditor","AR,IT,MK","Los autoeditores emplean software para dar formato a textos y gráficos de materiales impresos y electrónicas."
140,"Diesel Technician","Técnico en motores diésel","AR,IT,MK","Los técnicos en motores diesel mantienen y reparan motores de grandes vehículos y equipos industriales."
141,"Dietitian","Nutricionista","AG,HE,HS","Los nutricionistas brindan información y asesoramiento sobre alimentación y nutrición a particulares, organizaciones y compañías."
142,"Director","Director","AR","Los directores son expertos creativos y técnicos que toman los guiones y los convierten en obras de teatro, películas o programas de televisión."
143,"Director of Photography","Director de fotografía","AR","Los directores de fotografía se ocupan de la iluminación del set y de la filmación de una película o producción televisiva."
144,"Disc Jockey","Disc-jockey","AR","Los disc-jockeys seleccionan y reproducen la música para su público."
145,"Dispatcher","Operador","AR","Los teleoperadores responden llamadas telefónicas de pedidos de servicio o ayuda de emergencia, y coordinan a los equipos encargados de dar respuestas."
146,"Doctor","Médico","HE","Los médicos hacen diagnósticos y tratan a pacientes enfermos o lesionados."
147,"Drafter","Dibujante técnico","HE","Los dibujantes técnicos confeccionan dibujos detallados que se utilizan para la construcción de casas, oficinas, máquinas y sistemas eléctricos."
148,"Driving Instructor","Instructor de conducción","HE","Los instructores de conducción les enseñan a los conductores principiantes y con experiencia a manejar automóviles y otros vehículos de manera segura y legal."
149,"Dry Cleaner","Empleado del servicio de limpieza en seco","HE","Los empleados del servicio de limpieza en seco utilizan equipos y técnicas de limpieza sin agua para eliminar la suciedad y las manchas de prendas, cortinas y otras clases de telas."
150,"Drywaller","Mampostero","HE","Los mamposteros instalan paneles de mampostería que forman las paredes interiores y los techos de las viviendas, las oficinas, los negocios y demás edificios."
151,"Ecologist","Ecologista","AG,SC","Los ecologistas son científicos que estudian la forma en que los seres vivos interactúan entre sí y con los ambientes que los rodean."
152,"Economic Development Officer","Funcionario de desarrollo económico","GO","Los funcionarios de desarrollo económico proponen planes y proyectos para alentar la inversión comercial y al crecimiento económico en zonas urbanas y rurales."
153,"Economist","Economista","BU,FI,GO","Los economistas estudian los factores que influyen en la producción, la distribución y el consumo de bienes y servicios."
