301,"Nuclear Medicine Technologist","Tecnólogo en medicina nuclear","HE","Los tecnólogos en medicina nuclear realizan pruebas de diagnóstico por imágenes en las que utilizan materiales radioactivos para ayudar a los médicos a diagnosticar enfermedades."
302,"Nurse","Enfermero","HE","Los enfermeros asisten a los médicos y atienden a los pacientes en hospitales y otros centros de atención de la salud."
303,"Nurse Practitioner","Enfermero practicante","HE","Los enfermeros practicantes cuentan con capacitación avanzada y experiencia que les permiten realizar muchas de las tareas que, generalmente, estaban reservadas para los médicos."
304,"Nursery / Greenhouse Grower","Trabajador de vivero/invernadero","HE","Los trabajadores de viveros e invernaderos se ocupan de plantar, cuidar y vender todo tipo de plantas."
306,"Obstetrician-Gynecologist","Ginecobstetra","HE","Los obstetras atienden a mujeres embarazadas y asisten partos; los ginecólogos se especializan en el sistema reproductivo femenino."
307,"Occupational Therapist","Terapeuta ocupacional","HE","Los terapeutas ocupacionales trabajan con personas que tienen problemas físicos, mentales y de desarrollo para ayudarlos a recuperar o a desarrollar aptitudes."
308,"Oceanographer","Oceanógrafo","SC","Los oceanógrafos son científicos que estudian mares y océanos."
309,"Office Machine Repairer","Reparador de máquinas para oficina","SC","Los reparadores de máquinas para oficina reparan y realizan el mantenimiento de los equipos de oficina, como las computadoras, las impresoras y las fotocopiadoras."
310,"Office Manager","Gerente de oficina","BU","Los gerentes de oficina supervisan y coordinan las actividades cotidianas de grandes oficinas de todo tipo de organizaciones."
311,"Oil and Gas Well Drilling Crew","Personal de perforación de pozos gasíferos y petrolíferos","BU","Los miembros de los equipos de perforación de pozos gasíferos y petrolíferos operan equipos para hacer perforaciones de gran profundidad en la corteza terrestre a fin de extraer depósitos de petróleo y gas natural."
312,"Operations Research Analyst","Analista de investigación de operaciones","BU,SC,TR","Los analistas de investigación de operaciones emplean modelos matemáticos y computadoras para resolver problemas comerciales."
313,"Optician","Técnico óptico","BU,SC,TR","Los técnicos ópticos fabrican y ajustan anteojos de acuerdo con las recetas de los optometristas."
314,"Optometrist","Optometrista","HE","Los optometristas examinan los ojos de las personas para diagnosticar problemas de visión, enfermedades y otros trastornos oculares."
315,"Outdoor Guide","Guía de actividades al aire libre","HE","Los guías de actividades al aire libre dirigen grupos de personas en excursiones en parques naturales o zonas inexploradas, como caminatas o viajes de pesca."
316,"Painter","Pintor","HE","Los pintores cubren las superficies interiores y exteriores de los edificios con pinturas y revestimientos."
317,"Paralegal","Asistente legal","HE","Los asistentes legales colaboran con los abogados, realizan investigaciones legales, actualizan archivos y registros, y preparan documentos legales."
318,"Paramedic","Paramédico","HE","Los paramédicos, brindan atención médica inmediata en las situaciones de emergencia, y transportan a los pacientes a los hospitales."
319,"Park Warden / Ranger","Guardaparques/Guarda forestal","HE","Los guardaparques o guardas forestales se ocupan del cuidado de los parques estadounidenses; brindan protección al público, a los parques y a los animales para evitar que sufran daños."
320,"Parking Lot Attendant","Encargado de estacionamiento","HE","Los encargados de estacionamiento controlan los estacionamientos y reciben el pago de los clientes."
321,"Pediatrician","Pediatra","HE","Los pediatras son médicos que se especializan en la atención de personas jóvenes, desde recién nacidos hasta adolescentes."
322,"Personal Financial Planner","Planificador de finanzas personales","FI,HS","Los planificadores de finanzas personales ayudan a los clientes a aprovechar al máximo su dinero para que, tanto en el presente como en el futuro, sea posible satisfacer las necesidades financieras."
323,"Personal Trainer","Entrenador personal","FI,HS","Los entrenadores personales ofrecen entrenamiento personalizado y motivación para personas que desean mantener o mejorar su estado físico."
324,"Pest Controller","Controlador de plagas","FI,HS","Los controladores de plagas atrapan o exterminan insectos, murciélagos y roedores que infestan casas y negocios."
325,"Pet Groomer","Estilista de mascotas","FI,HS","Los estilistas de mascotas cortan y peinan el pelaje de perros, gatos y otros animales."
326,"Pharmacist","Farmacéutico","HE","Los farmacéuticos despachan medicamentos a los pacientes según las recetas de los médicos, y brindan información sobre su administración."
327,"Pharmacologist","Farmacólogo","HE,SC","Los farmacólogos estudian fármacos y su interacción con el cuerpo humano a fin de desarrollar nuevos medicamentos para combatir enfermedades."
328,"Pharmacy Technician","Técnico en farmacia","HE,SC","Los técnicos en farmacia preparan las recetas de los pacientes bajo la supervisión de farmacéuticos."
329,"Photographer","Fotógrafo","AR","Los fotógrafos utilizan cámaras para capturar imágenes que narran historias, ilustran situaciones o registran sucesos."
330,"Physicist","Físico","SC","Los físicos usan sus conocimientos en matemática y ciencias para desarrollar y probar teorías acerca de la naturaleza de la materia, y aplican los hallazgos de manera práctica."
331,"Physical Therapist","Fisioterapeuta","HE","Los fisioterapeutas evalúan y tratan a pacientes con problemas motrices producto de enfermedades, lesiones o discapacidades físicas."
332,"Picture Framer","Marquista","HE","Los marquistas agregan los últimos detalles a las pinturas y otras obras de arte al montarlas y enmarcarlas para los clientes."
333,"Pilot","Piloto","HE","Los pilotos son responsables de la operación eficiente y segura de todos los tipos de aeronaves de carga y pasajeros."
334,"Pipefitter","Instalador de cañerías","HE","Los instaladores de cañerías instalan, reparan y cambian las tuberías que transportan gas, agua o materias primas desde y hasta las casas y los comercios."
335,"Planner","Urbanista","AC,GO","Los urbanistas desarrollan planes y brindan asesoramiento sobre cómo usar la tierra a fin de satisfacer las necesidades de la comunidad."
336,"Plasterer","Yesero","AC,GO","Los yeseros crean superficies en paredes y techos mediante la aplicación de capas de yeso sobre los materiales base, como malla metálica."
337,"Plastic Surgeon","Cirujano plástico","HE","Los cirujanos plásticos son médicos que realizan cirugías estéticas y reconstructivas para mejorar el aspecto de las personas."
338,"Plumber","Plomero","HE","Los plomeros instalan, reparan y realizan el mantenimiento de tuberías, sistemas de tuberías y artefactos."
339,"Podiatrist","Podiatra","HE","Los podiatras diagnostican y tratan lesiones, enfermedades y deformidades en los pies."
340,"Police Officer","Agente u oficial de policía","HE","Los oficiales de policía se ocupan de brindar protección a las personas; para ello, ponen freno a la delincuencia y hacen cumplir la ley."
341,"Political Aide","Asesor político","GO","Los asesores políticos son asistentes de los políticos, y los mantienen organizados y actualizados acerca de temas políticos importantes."
342,"Politician","Político","GO","Los políticos ejercen influencia en la política, toman decisiones políticas y representan los intereses de los ciudadanos en los asuntos gubernamentales."
343,"Postal Clerk","Empleado postal","GO","Los empleados postales venden estampillas y otros servicios postales; además, clasifican la correspondencia para asegurarse de que llegue al destino correspondiente."
344,"Power Plant Operator","Operario de central eléctrica","GO","Los operadores de centrales eléctricas controlan y realizan el mantenimiento de las maquinas y los equipos que generan la electricidad."
345,"Print Journalist","Periodista gráfico","AR","Los periodistas gráficos escriben artículos para periódicos, revistas, publicaciones y fuentes de noticias en línea."
346,"Printing Press Operator","Prensista","AR","Los prensistas controlan las maquinarias que crean periódicos, revistas, catálogos, folletos y otro material impreso."
347,"Private Investigator","Investigador privado","LA","Los investigadores privados resuelven casos para personas y compañías, recogen pruebas relacionadas con personas perdidas y empleados que roban."
348,"Probation / Parole Officer","Funcionario a cargo de personas con libertad condicional","LA","Los funcionarios a cargo de personas con libertad condicional supervisan a los delincuentes que han quedado libres en la comunidad a fin de asegurarse de que respetan las reglas de dicho régimen."
349,"Producer","Productor","AR","Los productores reúnen a equipos de profesionales creativos y técnicos para hacer películas, programas de televisión y otras producciones."
350,"Production Woodworker","Carpintero de producción","AR","Los carpinteros de producción transforman la madera virgen en maderos utilizables y otros productos, o trabajan en fábricas dedicados a la fabricación de muebles, entre otras cosas."
351,"Professional Athlete","Atleta profesional","HT","Los atletas profesionales se entrenan y compiten en competencias deportivas, como partidos de baloncesto o de tenis."
352,"Professor","Catedrático","ED","Los catedráticos usan sus profundos conocimientos de un tema específico, como historia o física, para dar clase a estudiantes de nivel superior."
353,"IT Project Manager","Gerente de proyectos de tecnología de la información","BU,IT","Los gerentes de proyectos de tecnología de la información coordinan las actividades de profesionales que participan en el desarrollo de programas informáticos."
354,"Property Manager","Administrador de propiedades","AC,BU","Los administradores de propiedades se ocupan de las cuestiones comerciales involucradas en la operación de propiedades residenciales, comerciales o industriales."
355,"Prosthetist / Orthotist","Técnico protesista/Técnico ortesista","HE","Los técnicos protesistas y ortesistas diseñan, adaptan y modifican extremidades artificiales (prótesis) y corsés para la columna vertebral o las extremidades debilitadas (elementos ortopédicos)."
356,"Psychiatrist","Psiquiatra","ED,HE,HS","Los psiquiatras son médicos especialmente capacitados para diagnosticar y tratar a personas con trastornos mentales y emocionales."
357,"Psychologist","Psicólogo","ED,HE,HS","Los psicólogos hacen diagnósticos y tratan a pacientes que padecen problemas personales o trastornos psicológicos."
358,"Public Health Nurse","Enfermero de salud pública","HE","Los enfermeros de salud pública trabajan en la comunidad para promocionar, proteger y preservar la salud de las personas."
359,"Public Policy Analyst","Analista de políticas públicas","GO","Los analistas de políticas públicas estudian políticas, programas y leyes del gobierno."
360,"Public Relations Specialist","Especialista en relaciones públicas","AR,BU,MK","Los especialistas en relaciones públicas colaboran en el desarrollo, el mantenimiento o mejora de la imagen pública de un negocio o de una persona."
361,"Publisher","Coordinador de proyectos editoriales","AR","Los coordinadores de proyectos editoriales dirigen las compañías que producen libros, revistas, periódicos y publicaciones en línea."
362,"Purchaser","Responsable de compras","BU,MK,TR","Los responsables de compras tienen a su cargo la compra de mercaderías o servicios para que sus compañías los utilicen o vendan."
363,"Quality Controller","Inspector de control de calidad","AG,HE,IT, MF,SC","Los inspectores de control de calidad realizan inspecciones y análisis para asegurarse de que los productos se elaboren correctamente, de modo seguro y conforme a las normas correspondientes."
364,"Radiation Therapist","Radioterapeuta","HE","Los radioterapeutas usan radiación de alta energía para detener el crecimiento y la multiplicación de las células cancerosas en pacientes que padecen cáncer."
365,"Real Estate Agent","Agente inmobiliario","AC,MK","Los agentes inmobiliarios ayudan a los clientes a comprar, vender, arrendar o alquilar sus propiedades."
366,"Real Estate Appraiser","Tasador inmobiliario","AC","Los tasadores inmobiliarios calculan el valor de las propiedades residenciales, comerciales e industriales."
367,"Receptionist / Information Clerk","Recepcionista/Asistente del servicio de información","AC","Los recepcionistas y asistentes del servicio de información constituyen la primera línea de comunicación que las organizaciones tienen con los clientes, los inversionistas o el público."
368,"Recording Engineer","Ingeniero de grabación","AR","Los ingenieros de grabación utilizan equipos electrónicos para grabar, mezclar y editar sonidos, que incluyen piezas cantadas, música y efectos de sonido."
369,"Recreation Director","Director de recreación","HT","Los directores de recreación administran gimnasios y centros comunitarios."
370,"Recreation Therapist","Terapeuta recreativo","HE,HS","Los terapeutas recreativos utilizan actividades de esparcimiento para mejorar la salud de personas enfermas, heridas o con discapacidades."
372,"Rehabilitation Counselor","Consejero de rehabilitación","HE,HS","Los consejeros de rehabilitación ayudan a las personas lesionadas a reintegrarse a sus lugares de trabajo y a reanudar sus actividades diarias normales."
373,"Religious Worker","Trabajador religioso","HE,HS","Los trabajadores religiosos organizan e implementan programas que ofrecen alimento, refugio y apoyo social en nombre de las organizaciones religiosas."
375,"Research Analyst (Financial)","Analista de investigación (financiero)","FI","Los analistas de investigación analizan las empresas y recomiendan a los inversores si deben comprar, conservar o vender las acciones que tienen en ellas."
376,"Researcher","Investigador","BU,GO,HE,SC","Los investigadores encuentran, evalúan y resumen información para bancos, compañías aseguradoras, agencias de publicidad y muchas otras empresas."
378,"Respiratory Therapist","Terapeuta respiratorio","HE","Los terapeutas respiratorios ayudan a los médicos a diagnosticar y tratar a pacientes con problemas respiratorios producto de enfermedades pulmonares o emergencias médicas."
379,"Restaurant Manager","Gerente de restaurante","HT","Los gerentes de restaurantes coordinan las actividades de los empleados de restaurantes, comedores, cafés y otros lugares para comer."
380,"Retail Buyer","Comprador minorista","BU,MK","Los compradores minoristas seleccionan, encargan y compran mercaderías que luego se venderán por almacenes, grandes tiendas y otros minoristas."
381,"Retail Salesperson","Vendedor minorista","BU,MK","Los vendedores minoristas ayudan a los clientes a encontrar y escoger mercaderías en tiendas minoristas, y reciben los pagos."
382,"Road Construction and Maintenance Worker","Trabajador de construcción y mantenimiento vial","BU,MK","Los trabajadores de construcción y mantenimiento vial se ocupan del mantenimiento y la reparación de los caminos existentes, así como de la construcción de nuevas vías."
383,"Roofer","Techador","BU,MK","Los techadores construyen y reparan techos para proteger a los edificios del daño causado por el agua."
384,"Sales Representative","Representante de ventas","MK","Los representantes de ventas venden productos y servicios a los clientes."
385,"Scientist","Científico","SC","Los científicos estudian el mundo físico para responder preguntas acerca de él, como de qué está hecho y cómo comenzó."
386,"High School Teacher","Profesor de escuela secundaria","ED","Los profesores de escuela secundaria enseñan una o dos materias a los alumnos de dicha escuela."
387,"Security Guard","Guardia de seguridad","ED","Los guardias de seguridad protegen edificios y áreas contra robos, incendios, vandalismo e ingreso ilegal."
388,"Security Systems Technician","Técnico en sistemas de seguridad","ED","Los técnicos en sistemas de seguridad instalan y reparan alarmas contra incendio y robo, sistemas de intercomunicación y otros equipos de seguridad electrónica."
389,"Set Designer","Escenógrafo","AR","Los escenógrafos construyen y arman las escenografías de programas de televisión, películas y producciones teatrales."
391,"Sheet Metal Worker","Obrero metalúrgico","AR","Los obreros metalúrgicos fabrican e instalan partes de los edificios que están hechas con planchas metálicas, como sistemas de conductos, techos y canaletas."
392,"Ships Crew","Tripulante de barco","AR","Los integrantes de la tripulación de un barco se ocupan del mantenimiento y la operación de barcos que transportan carga y pasajeros a través de ríos, lagos y océanos."
393,"Shipping and Receiving Clerk","Empleado de expedición y recepción","AR","Los empleados de expedición y recepción organizan y preparan elementos para su envío, y reciben elementos a medida que llegan."
394,"Sign Maker","Realizador de carteles","AR,MK","Los realizadores de carteles diseñan y crean los carteles que solemos ver, desde los pequeños que encontramos en escaparates hasta carteleras enormes."
395,"Small Engine Mechanic","Mecánico de motores pequeños","AR,MK","Los mecánicos de motores pequeños mantienen y reparan todo tipo de motores, desde los de motosierras hasta aquellos de embarcaciones pesqueras motorizadas."
396,"Social Worker","Trabajador social","ED,HE,HS","Los trabajadores sociales proporcionan a las personas y a las familias los recursos y el apoyo necesarios para enfrentar asuntos personales y sociales."
397,"Sound Technician","Técnico en sonido","ED,HE,HS","Los técnicos en sonido se aseguran de que el público disfrute de la mejor calidad acústica posible durante películas, espectáculos de televisión, obras de teatro, conciertos y avisos comerciales."
398,"Special Education Teacher","Maestro de educación especial","ED","Los maestros de educación especial dan clases a alumnos con necesidades especiales, incluidos aquellos con discapacidades físicas o problemas de aprendizaje."
399,"Special Effects Technician","Técnico en efectos especiales","ED","Los técnicos en efectos especiales crean las ilusiones visuales que se utilizan en las películas, los programas de televisión, los avisos comerciales y las producciones teatrales."
400,"Speech-Language Pathologist","Patólogo del habla y el lenguaje","ED,HE","Los patólogos del habla y el lenguaje trabajan con personas que tienen problemas del habla, el lenguaje y la deglución para ayudarlos a mejorar su comunicación."
401,"Sports Instructor","Instructor deportivo","ED,HE,HT,HS","Los instructores deportivos les enseñan a los deportistas aficionados a practicar los deportes y a trabajar con atletas competitivos para mejorar sus técnicas."
402,"Sports Marketer","Especialista en marketing deportivo","HT,MK","Los especialistas en marketing deportivo aumentan la exposición pública de equipos deportivos, patrocinadores de eventos y causas benéficas."
403,"Sports Official","Árbitro deportivo","HT,MK","Los árbitros deportivos se aseguran de que los atletas respeten las reglas en deportes como el baloncesto, el tenis, el fútbol y el béisbol."
404,"Stationary Engineer","Ingeniero estacionario","AC,MF","Los ingenieros estacionarios se ocupan del control y el mantenimiento de los sistemas de aire acondicionado y calefacción de plantas industriales y edificios grandes."
405,"Statistician","Estadístico","BU,GO,SC","Los estadísticos utilizan matemática avanzada para ayudar a científicos, economistas, ingenieros y otros profesionales a resolver problemas."
406,"Stenographer","Estenógrafo","BU,GO,SC","Los estenógrafos emplean técnicas de escritura especiales y máquinas de dictado para registrar las comunicaciones orales."
407,"Stock Clerk","Empleado de almacén","BU,GO,SC","Los empleados de almacén reciben y organizan los envíos de productos en almacenes y tiendas minoristas."
408,"Stuntperson","Doble de escenas de riesgo","BU,GO,SC","Los dobles chocan vehículos, escapan de explosiones y realizan otras escenas de riesgo físico para la televisión, el cine y otras producciones."
410,"Surgeon","Cirujano","HE","Los cirujanos son médicos que realizan cirugías en cualquier parte del cuerpo humano para corregir problemas ocasionados por lesiones o enfermedades."
411,"Television and Radio Reporter","Reportero de radio y televisión","AR","Los reporteros de radio y televisión escriben historias sobre temas de actualidad para ser emitidas por radio o televisión."
412,"Tailor / Dressmaker","Sastre/Modisto","AR","Los sastres y modistos diseñan, fabrican, modifican y arreglan prendas."
413,"Tattoo Artist","Artista tatuador","AR","Los tatuadores utilizan máquinas eléctricas para crear tatuajes permanentes en la piel de los clientes."
414,"Taxi Driver","Taxista","AR","Los taxistas transportan a los pasajeros de un lugar a otro en automóviles y camionetas."
415,"Taxidermist","Taxidermista","AR","Los taxidermistas montan las pieles de animales en modelos esculpidos para elaborar reproducciones realistas de ciervos, osos y otros animales."
416,"Technical Sales Representative","Representante técnico de ventas","AR","Los representantes técnicos de ventas emplean sus conocimientos técnicos para vender productos especializados, como productos químicos, maquinarias o fármacos."
417,"Technical Writer","Escritor técnico","AR","Los escritores técnicos crean manuales, informes y herramientas de ayuda en línea que facilitan la comprensión de información técnica."
418,"Telemarketer","Vendedor telefónico","AR","Los vendedores telefónicos venden productos, recolectan donaciones y realizan encuestas telefónicas."
420,"Telephone Operator","Telefonista","AR","Los telefonistas responden llamadas de compañías telefónicas y otros comercios, y brindan asistencia a las personas que llaman."
421,"Tilesetter","Colocador de baldosas","AR","Los colocadores de baldosas instalan y reparan baldosas en todo tipo de lugares, desde baños hasta centros comerciales y piscinas."
422,"Tool and Die Maker","Fabricante de herramientas y matrices","AR","Los fabricantes de herramientas y matrices crean piezas de metal de precisión (herramientas, matrices y moldes) que se emplean para la manufactura de todo tipo de artículos."
423,"Tour Guide","Guía de turismo","HT","Los guías de turismo ayudan a los viajeros a descubrir sus destinos, les muestran los lugares y responden sus preguntas."
424,"Tow Truck Driver","Chofer de remolque","HT","Los choferes de remolque retiran los vehículos dañados o estacionados en lugares no permitidos de las escenas de accidentes, caminos y estacionamientos."
425,"Trader","Intermediario","FI","Los intermediarios compran y venden títulos, bonos, divisas y acciones en empresas, para obtener ganancias para la firma a la que pertenecen."
426,"Transit Operator","Operador de tránsito","FI","Los operadores de tránsito transportan pasajeros en autobuses urbanos, subterráneos y tranvías."
427,"Translator","Traductor","ED,GO,LA","Los traductores traducen información escrita de un idioma a otro."
428,"Travel Agent","Agente de viajes","HT,MK","Los agentes de viaje se ocupan de organizar viajes para los viajeros y de brindarles asesoramiento e información al respecto."
429,"Tree Harvester","Trabajador forestal","HT,MK","Los trabajadores forestales emplean grandes máquinas y motosierras para talar y podar árboles."
430,"Truck Driver","Camionero","HT,MK","Los camioneros transportan bienes y materiales en camiones y camiones con acoplado."
432,"Upholsterer","Tapicero","HT,MK","Los tapiceros cubren muebles con tela, cuero u otros materiales de tapicería."
433,"Vending Machine Servicer","Abastecedor/Técnico de máquinas expendedoras","HT,MK","Los abastacedores y técnicos de máquinas expendedoras instalan, reparan y realizan el mantenimiento de mecanismos que se operan con monedas y que proporcionan bebidas, golosinas y otros productos."
434,"Venture Capitalist","Inversionista de riesgo","FI","Los inversionistas de riesgo son inversionistas que proporcionan financiación a comercios nuevos y en crecimiento."
435,"Veterinarian","Veterinario","AG,HE","Los veterinarios diagnostican y tratan a los animales enfermos y heridos, entre ellos, perros, gatos, caballos y vacas."
436,"Veterinary Technician","Técnico veterinario","AG,HE","Los técnicos veterinarios ayudan a los veterinarios a tratar y cuidar a los animales."
437,"Video Game Developer","Desarrollador de videojuegos","AR,IT","Los desarrolladores de videojuegos diseñan, crean y prueban videojuegos."
438,"Waiter","Camarero","AR,IT","Los camareros toman nota de los pedidos de los clientes y les sirven alimentos y bebidas."
439,"Waste Collector","Recolector de residuos","AR,IT","Los recolectores de residuos recogen y desechan basura y materiales reciclables de hogares, negocios y industrias."
440,"Water Treatment Plant Operator","Operario de planta de tratamiento de agua","AG","Los operadores de plantas de tratamiento de agua controlan el equipo utilizado para purificar el agua potable y se ocupan del tratamiento y la eliminación de aguas residuales."
442,"Web Developer","Programador de web","IT,MK","Los programadores de web construyen sitios web y desarrollan aplicaciones para la web."
443,"Webmaster","Administrador de web","IT,MK","Los administradores de web se encargan de administrar las actividades de los sitios web, de actualizar el contenido de estos y de garantizar su correcto funcionamiento."
