154,"Editor","Editor","AR","Los editores seleccionan, revisan y preparan libros, artículos y otros materiales escritos para su publicación."
155,"Electrical Engineering Tech","Técnico en ingeniería eléctrica","AR","Los técnicos en ingeniería eléctrica ayudan a los ingenieros a desarrollar, fabricar y mantener una amplia variedad de productos y equipos eléctricos."
156,"Electrical Engineer","Ingeniero electricista","IT,MF,SC","Los ingenieros electricistas diseñan y fabrican equipos eléctricos, o trabajan en la producción, transmisión y distribución de electricidad."
157,"Electrician","Electricista","IT,MF,SC","Los electricistas se encargan de instalar, reparar y mantener sistemas eléctricos donde se los necesite."
158,"Electroneurodiagnostic Tech","Técnico en electroneurodiagnóstico","IT,MF,SC","Los técnicos en electroneurodiagnóstico utilizan equipos para medir y registrar la actividad eléctrica en el cerebro y el sistema nervioso de los pacientes"
159,"Electronics Assembler","Montador electrónico","IT,MF,SC","Los montadores electrónicos ensamblan las piezas electrónicas de computadoras, equipos estereofónicos, médicos, entre otros."
160,"Electronics Engineering Tech","Técnico en ingeniería electrónica","IT,MF,SC","Los técnicos en ingeniería electrónica instalan, reparan y mantienen dispositivos electrónicos, y ayudan a los ingenieros a desarrollar, construir y probar nuevas tecnologías."
161,"Electronics Repairer","Reparador de equipos electrónicos","IT,MF,SC","Los reparadores de equipos electrónicos reparan y realizan el mantenimiento de equipos electrónicos, como los televisores, las cámaras y las computadoras."
162,"Elementary School Teacher","Maestro de escuela primaria","ED","Los maestros de escuela primaria dan clases a los niños desde jardín de infantes hasta sexto grado."
163,"Elevator Installer and Repairer","Instalador y reparador de ascensores","ED","Los instaladores y reparadores de ascensores se ocupan de la fabricación, el mantenimiento y la reparación de ascensores eléctricos o hidráulicos, tanto de carga como de pasajeros."
164,"Engineering Tech","Técnico en ingeniería","ED","Los técnicos en ingeniería ofrecen a los ingenieros la asistencia técnica necesaria para llevar las ideas a la práctica."
165,"Entrepreneur","Empresario","BU,MK","Los empresarios organizan y dirigen negocios nuevos."
166,"Environmental Engineer","Ingeniero ambiental","AG,MF,SC","Los ingenieros ambientales ayudan a mantener ambientes limpios y saludables a través de la protección de la calidad del aire, el suelo y el agua."
167,"Environmental Health Inspector","Inspector de salud ambiental","GO,LA","Los inspectores de salud ambiental protegen a las comunidades de enfermedades mediante la inspección de restaurantes, hoteles, piscinas y otros lugares públicos."
168,"Environmental Technician","Técnico en medio ambiente","GO,LA","Los técnicos en medio ambiente obtienen y analizan muestras de aire, agua y suelo de áreas contaminadas con el objetivo de ayudar a controlar y a evitar la contaminación."
169,"Epidemiologist","Epidemiólogo","HE,SC","Los epidemiólogos emplean estadísticas para determinar las causas de las enfermedades en las poblaciones."
170,"ESL Teacher","Profesor de inglés como segundo idioma","ED,HS","Los profesores de inglés como segundo idioma enseñan el idioma inglés a personas no angloparlantes."
171,"Esthetician","Esteticista","ED,HS","Los esteticistas tratan y cuidan la piel para que esté saludable y tenga un buen aspecto."
172,"Event Planner","Planificador de eventos","BU,HT,HS","Los planificadores de eventos organizan convenciones, exposiciones, bodas y otros eventos."
173,"Exhibit Designer","Diseñador de exposiciones","AR,HT","Los diseñadores de exposiciones crean muestras atractivas en lugares educacionales, como centros científicos, museos y zoológicos."
174,"Explosives Specialist","Especialista en explosivos","AG,AC,LA","Los especialistas en explosivos trabajan en muchos campos diferentes, tanto en la creación como en la prevención de explosiones."
175,"Family Physician","Médico familiar","HE","Los médicos familiares atienden a los pacientes desde el primer año de vida hasta la vejez, diagnostican y tratan una amplia variedad de enfermedades."
176,"Farm Equipment Technician","Técnico de maquinaria agrícola","HE","Los técnicos de maquinaria agrícola mantienen, ajustan y reparan maquinaria agrícola como tractores, cosechadoras, enfardadoras, sembradoras y segadoras."
177,"Farmer","Granjero o productor agropecuario","AG","Los granjeros cultivan, crían y venden granos y ganado, lo que incluye maíz, trigo, reses y cerdos."
178,"Fashion Designer","Diseñador de moda","AR","Los diseñadores de moda diseñan diferentes tipos de ropa para crear nuevos estilos de moda y reinventar los estilos viejos."
179,"Fashion Retailer","Minorista de modas","AR","Los minoristas de modas compran y venden ropa y accesorios."
180,"Fast Food Worker","Empleado de un restaurante de comida rápida","AR","Los empleados de los restaurantes de comida rápida atienden a los clientes y elaboran platos en restaurantes de servicio rápido, como Burger King."
181,"Film and TV Crew","Equipo de rodaje","AR","Los miembros de los equipos de rodaje trabajan detrás de escena para garantizar que la producción de películas y programas de televisión se desarrolle sin inconvenientes."
182,"Film Editor","Editor de cine","AR","Los editores de cine toman todas las secuencias de películas y programas de televisión y las compaginan para hacer el producto final."
183,"Photographic Processor","Procesador de fotografías","AR","Los procesadores de fotografías crean copias fotográficas de películas expuestas, negativos y cámaras digitales."
184,"Firefighter","Bombero","AR","Los bomberos protegen al público al responder a incendios, explosiones y otras emergencias."
185,"Fisher","Pescador","AR","Los pescadores pescan y venden peces, langostas, calamares y otras especies marinas."
186,"Fitness Instructor","Instructor de preparación física","AR","Los instructores de preparación física ayudan a las personas a ponerse en forma al dar clases en actividades como gimnasia aeróbica o yoga."
187,"Flight Attendant","Azafata","AR","Las azafatas garantizan que los pasajeros del avión disfruten de un vuelo seguro, cómodo y agradable."
188,"Flooring Installer","Instalador de pisos","AR","Los instaladores de pisos colocan alfombras, vinilo y otros tipos de revestimientos en casas y otros edificios."
189,"Florist","Florista","AR","Los floristas trabajan con flores y plantas para crear ramos, centros de mesa, coronas y otros arreglos florales para los clientes."
190,"Food Inspector","Inspector de alimentos","AG,GO,LA","Los inspectores de alimentos hacen cumplir las leyes gubernamentales acerca de la elaboración y manipulación de alimentos, y así garantizan su seguridad."
193,"Forester","Silvicultor","AG","Los silvicultores colaboran con la administración de bosques, desde realizar investigaciones hasta brindar asesoramiento sobre la conservación forestal."
194,"Forestry Technician","Técnico forestal","AG","Los técnicos forestales trabajan en diversas áreas relacionadas con la administración de bosques, que incluyen la tala, la conservación forestal y la investigación."
195,"Fruit and Vegetable Grower","Productor de frutas y verduras","AG","Los productores de frutas y verduras plantan, cosechan y venden manzanas, calabazas, lechuga y mazorcas de maíz."
196,"Fundraiser","Recaudador de fondos","BU,MK","Los recaudadores de fondos reúnen fondos para organizaciones, como instituciones benéficas y hospitales, y generan conciencia respecto de la causa de cada una de ellas."
197,"Funeral Director","Director de funerales","BU,MK","Los directores de funerales organizan funerales y se ocupan del cuerpo de la persona fallecida, ayudando a las familias que han sufrido la pérdida de un ser querido."
198,"Furniture Finisher","Acabador de muebles","BU,MK","Los acabadores de muebles aplican acabados nuevos, como pintura, barniz o tintura sobre muebles nuevos y antiguos."
199,"Gardener","Jardinero","BU,MK","Los jardineros se ocupan del mantenimiento del césped, jardines, campos de golf y otros espacios abiertos."
201,"Geologist","Geólogo","AG,SC","Los geólogos son científicos que estudian la historia y la estructura de la corteza terrestre, así como las rocas y los minerales que la componen."
203,"Gerontologist","Gerontólogo","HE,HS","Los gerontólogos son profesionales que trabajan con ancianos o que realizan investigaciones para entender y satisfacer las necesidades de estas personas."
204,"Glazier","Vidriero","HE,HS","Los vidrieros seleccionan, cortan e instalan todo tipo de paneles de vidrio, como ventanas y puertas, en edificios."
205,"Graphic Designer","Diseñador gráfico","AR","Los diseñadores gráficos son expertos en comunicación visual que se dedican a diseñar diversos productos; entre ellos, logotipos, anuncios publicitarios, folletos y envases de productos."
206,"Gunsmith","Armero","AR","Los armeros diseñan, fabrican y reparan armas de fuego, incluidos los rifles, las pistolas y las escopetas."
207,"Hairstylist","Peluquero","AR","Los peluqueros cortan, peinan y tiñen el cabello y los postizos."
208,"Health Care Administrator","Administrador de servicios de salud","BU,HE","Los administradores de servicios de salud trabajan entre bambalinas en hospitales y otros centros médicos para garantizar que estos establecimientos funcionen correctamente."
209,"Health Records Professional","Responsable de la administración de historias clínicas","BU,HE","Los responsables de la administración de historias clínicas se aseguran de que los médicos tengan acceso a las historias clínicas de los pacientes mediante su organización y administración."
211,"Heating, Air Conditioning, Refrigeration Tech","Técnico de calefacción, aire acondicionado y refrigeración","BU,HE","Los técnicos de calefacción, aire acondicionado y refrigeración instalan y realizan el mantenimiento de las unidades de calor y frío en casas y demás edificios."
212,"Heavy Equipment Technician","Técnico de maquinaria pesada","BU,HE","Los técnicos en maquinaria pesada mantienen y reparan vehículos industriales como excavadoras, camiones, topadoras y grúas."
213,"Heavy Equipment Operator","Operador de maquinaria pesada","BU,HE","Los operarios de maquinaria pesada controlan los inmensos equipos que se utilizan para construir de todo, desde autopistas hasta estadios deportivos."
214,"Helicopter Pilot","Piloto de helicóptero","BU,HE","Los pilotos de helicóptero conducen aviones de ala rotatoria en numerosas situaciones, incluidas misiones de rescate y viajes de placer."
215,"Historian","Historiador","AR,ED","Los historiadores estudian los eventos del pasado y brindan información sobre la historia a estudiantes o al público en general."
216,"Personal Care Aide","Trabajador de apoyo personal","AR,ED","Los trabajadores de apoyo personal proporcionan atención personalizada a clientes con discapacidades, personas enfermas o ancianas, tanto en sus hogares como en centros de atención."
217,"Family and Consumer Scientist","Especialista en ciencias de la familia y el consumidor","HS","Los especialistas en ciencias de la familia y el consumidor realizan investigaciones y brindan asesoramiento sobre alimentación y nutrición, finanzas y otras cuestiones relacionadas con la administración del hogar."
218,"Home Inspector","Inspector de viviendas","AC","Los inspectores de viviendas examinan las casas y otros edificios en busca de señales de daño, deterioro y construcción insegura."
219,"Homemaker","Encargado de la casa","AC","Los encargados de la casa trabajan en sus propios hogares, se ocupan de la crianza de los hijos y de la administración de las finanzas y responsabilidades domésticas."
220,"Horticulturist","Horticultor","AG","Los horticultores plantan, se ocupan del mantenimiento y venden árboles, arbustos, flores y otros tipos de plantas."
221,"Hotel Desk Clerk","Conserje de hotel","AG","Los conserjes de hoteles brindan atención al cliente en hoteles, registran el ingreso y egreso de los huéspedes y se ocupan de sus preguntas y quejas."
222,"Hotel Manager","Gerente de hotel","HT","Los gerentes de hotel dirigen las operaciones de todo el hotel, se aseguran de que todo funcione correctamente y de que el hotel sea rentable."
223,"Housekeeper","Encargado de limpieza","HT","Los empleados de limpieza se ocupan de la limpieza y el mantenimiento de casas, hoteles, oficinas y otros establecimientos."
224,"Human Resources Specialist","Especialista en recursos humanos","BU","Los especialistas en recursos humanos se encargan de contratar, despedir y capacitar al personal; además, se ocupan de otros aspectos relacionados con las fuerzas laborales de una compañía."
225,"Hydrologist / Hydrogeologist","Hidrólogo/Hidrogeólogo","AG,SC","Los hidrólogos e hidrogeólogos estudian el abastecimiento de agua en el mundo y se aseguran de que la población disponga de suficiente agua limpia y potable."
226,"Illustrator","Ilustrador","AR","Los ilustradores dibujan diversos tipos de imágenes para revistas, libros de texto, catálogos, anuncios publicitarios y diferentes publicaciones y proyectos."
228,"Industrial Designer","Diseñador industrial","AR,MF","Los diseñadores industriales crean productos fabricados, como automóviles, aparatos eléctricos, electrodomésticos y otros artículos de uso diario."
229,"Industrial Engineer","Ingeniero industrial","MF,SC","Los ingenieros industriales ayudan a las compañías a ser más productivas; para ello, estudian sus operaciones y sugieren métodos más eficaces para llevar a cabo sus actividades."
230,"Industrial Engineering Tech","Técnico en ingeniería industrial","MF,SC","Los técnicos en ingeniería industrial trabajan con los ingenieros para que los procesos de fabricación, producción y otros procedimientos de trabajo sean más eficientes."
231,"Industrial Machinery Mechanic","Mecánico de maquinaria industrial","MF,SC","Los mecánicos de maquinaria industrial se ocupan del mantenimiento y la reparación de las máquinas de producción de plantas y fábricas."
232,"Infantry","Soldado de infantería","MF,SC","Los soldados de infantería capturan o destruyen fuerzas hostiles en tierra en tiempos de guerra; además, dirigen a los soldados."
233,"Insulator","Instalador de aislamiento","MF,SC","Los instaladores de aislamiento instalan materiales aislantes para controlar el paso del calor y del sonido a través de muros y otras estructuras."
234,"Insurance Agent","Agente de seguros","FI,MK","Los agentes y corredores de seguros venden pólizas de seguros a particulares y comercios."
235,"Insurance Claims Adjuster","Liquidador de siniestros","FI","Los liquidadores de siniestros investigan las reclamaciones de seguros para garantizar su validez y determinar el monto de dinero que deben recibir los demandantes."
236,"Insurance Underwriter","Asegurador","FI","Los aseguradores revisan solicitudes de seguros y deciden si aceptar o rechazar la concesión de seguros a personas o comercios."
237,"Interior Designer","Diseñador de interiores","AC,AR","Los diseñadores de interiores convierten las casas y oficinas en espacios cubiertos placenteros y funcionales."
239,"Interpreter","Intérprete","BU,GO,HS,LA","Los intérpretes traducen palabras habladas de un idioma a otro."
240,"Inventor","Inventor","SC","Los inventores idean, fabrican y comercializan productos y dispositivos nuevos."
241,"Investment Advisor","Asesor de inversiones","FI","Los asesores de inversiones sugieren a los clientes la mejor inversión que pueden realizar."
242,"Investment Banker","Asesor bancario de inversiones","FI","Los asesores bancarios de inversión actúan como intermediarios de grandes compañías, y brindan asesoramiento y orientación respecto de transacciones financieras de alto nivel."
243,"Ironworker","Herrero","FI","Los herreros trabajan con metales para fabricar y ensamblar los bastidores metálicos que sostienen edificios de gran magnitud."
244,"Jeweler","Joyero","AR","Los joyeros fabrican, reparan, venden y tasan todo tipo de joyas."
245,"Judge","Juez","LA","Los jueces presiden los tribunales para garantizar que estos impartan justicia respetando los derechos legales de las personas."
246,"Kinesiologist","Kinesiólogo","HE","Los kinesiólogos usan su conocimiento del movimiento del cuerpo humano para tratar a pacientes enfermos o lesionados mediante ejercicios y para diseñar lugares de trabajo ergonómicos."
247,"Land Surveyor","Agrimensor","AG,AC","Los agrimensores miden y trazan mapas de parcelas."
248,"Landscape Architect","Arquitecto paisajista","AC","Los arquitectos paisajistas diseñan y crean jardines, parques públicos y otros espacios al aire libre."
249,"Landscaper","Paisajista","AC","Los paisajistas crean y se ocupan del mantenimiento de jardines, patios y otros espacios exteriores."
250,"Lawyer","Abogado","LA","Los abogados representan y asesoran a sus clientes durante los procedimientos judiciales, como juicios o negociaciones."
251,"Librarian","Bibliotecario","ED,GO,HS","Los bibliotecarios organizan y administran colecciones de recursos de información, incluidos libros, periódicos y bases de datos en línea."
252,"Library Technician","Técnico bibliotecario","ED,GO,HS","Los técnicos bibliotecarios ayudan a las personas a encontrar los libros, los trabajos y la información que necesitan, y les enseñan cómo usar las bases de datos y los catálogos de la biblioteca."
253,"Lifeguard","Guardavidas","ED,GO,HS","Los guardavidas supervisan las playas y las piscinas para asegurarse de que los nadadores estén a salvo y disfruten del agua."
254,"Lighting Technician","Técnico de iluminación","ED,GO,HS","Los técnicos de iluminación instalan, mantienen y operan unidades de iluminación y equipos eléctricos en escenografías televisivas, cinematográficas y teatrales."
255,"Lineworker","Instalador de líneas","ED,GO,HS","Los instaladores de líneas instalan y reparan cables aéreos y subterráneos que transmiten electricidad, así como señales telefónicas y de televisión por cable."
256,"Lobbyist","Cabildero","GO","Los cabilderos trabajan en representación de grupos con intereses especiales y organizaciones, para ejercer influencia en la política y la legislación gubernamental."
257,"Locksmith","Cerrajero","GO","Los cerrajeros instalan nuevas cerraduras y sistemas de alarma, además de hacer llaves y reparar cerraduras viejas y dañadas."
259,"Logistics Specialist","Especialista en logística","BU,MF,MK,TR","Los especialistas en logística encuentran las maneras más rentables de transportar materiales, personas, energía e información para grandes comercios."
260,"Machinist","Maquinista","BU,MF,MK,TR","Los maquinistas utilizan máquinas herramientas, como tornos, fresadoras y centros de maquinado para crear piezas metálicas de precisión."
261,"Mail Carrier","Cartero","BU,MF,MK,TR","Los carteros transportan paquetes y cartas desde la oficina de correos hasta los hogares y comercios."
262,"Makeup Artist","Maquillador artístico","BU,MF,MK,TR","Los maquilladores artísticos aplican cosméticos, polvos, pinturas, geles y otros productos en el rostro de los actores y otros artistas."
263,"Management Consultant","Consultor en administración de empresas","BU","Los consultores en administración de empresas analizan las compañías a fin de encontrar alternativas para hacerlas más eficientes y rentables."
264,"Nail Technician","Técnico de uñas","BU","Los técnicos de uñas cuidan y embellecen uñas naturales y postizas de las manos y los pies."
265,"Manufacturing Machine Operator","Operario de maquinaria de fabricación","BU","Los operarios de maquinaria de fabricación usan máquinas y equipos para convertir materias primas en productos terminados en fábricas."
266,"Marine Biologist","Biólogo marino","SC","Los biólogos marinos estudian las plantas y los animales que viven en los océanos y los mares."
267,"Market Research Analyst","Analista de investigación de mercado","BU,MK","Los analistas de investigación de mercado estudian y predicen las ventas de productos y servicios, como automóviles o seguros."
268,"Marketing Specialist","Especialista en marketing","BU,MK","Los especialistas en marketing desarrollan planes y estrategias para ayudar a las compañías a mejorar las ventas de sus productos o servicios."
269,"Marriage and Family Therapist","Terapeuta matrimonial y familiar","HS","Los terapeutas matrimoniales y familiares dan consejos a familias, parejas y otras personas que tienen problemas que afectan sus relaciones."
270,"Massage Therapist","Masajista","HS","Los masajistas manipulan los músculos y otros tejidos blandos de los pacientes con las manos para reducir el dolor y el estrés que estos sienten."
271,"Materials / Metallurgical Engineer","Ingeniero metalúrgico y en materiales","SC","Los ingenieros metalúrgicos y en materiales crean nuevos tipos de materiales, como polímeros y aleaciones, conforme a especificaciones precisas."
273,"Mechanical Engineer","Ingeniero mecánico","SC","Los ingenieros mecánicos diseñan, crean y reparan máquinas y sistemas mecánicos de todo tipo."
274,"Mechanical Engineering Tech","Técnico en ingeniería mecánica","SC","Los técnicos en ingeniería mecánica colaboran en el diseño, la fabricación, la instalación y la evaluación de maquinarias y otros sistemas utilizados para la producción de artículos y servicios."
275,"Media Buyer","Comprador de espacios publicitarios","AR,BU,MK","Los compradores de espacios publicitarios adquieren tiempos y espacios publicitarios en nombre de las compañías que desean promocionar sus productos."
276,"Mediator","Mediador","BU,GO,HS","Los mediadores ayudan a las personas a resolver controversias mediante deliberaciones y negociaciones."
277,"Medical Imaging Tech","Técnico en diagnóstico médico por imágenes","BU,GO,HS","Los técnicos en diagnóstico médico por imágenes ayudan a los médicos a diagnosticar problemas de salud; para ello, utilizan equipos que producen imágenes de los órganos, los huesos y los tejidos de los pacientes."
278,"Medical Lab Tech","Técnico de laboratorio médico","BU,GO,HS","Los técnicos de laboratorio médico ayudan a los médicos a diagnosticar enfermedades mediante el análisis de las muestras de tejidos, sangre y orina de los pacientes."
280,"Meteorologist","Meteorólogo","AG,SC","Los meteorólogos estudian los patrones y los cambios en la atmósfera y utilizan esta información para pronosticar el clima."
281,"Microbiologist","Microbiólogo","AG,SC","Los microbiólogos estudian organismos diminutos, como bacterias, hongos y virus, y desarrollan maneras de utilizarlos con el fin de ayudar a las personas."
282,"Midwife","Partera","HE,HS","Las parteras asisten a los mujeres con embarazos y partos normales, tomando en cuenta la filosofía de dejar que el parto sea lo más natural posible."
285,"Millwright","Mecánico industrial","HE,HS","Los mecánicos industriales se ocupan de la instalación, el mantenimiento y la reparación de las máquinas que les permiten elaborar sus productos."
286,"Miner (Underground)","Minero (subterráneo)","HE,HS","Los mineros perforan túneles subterráneos y extraen materiales, como minerales metalíferos, rocas o carbón."
287,"Mining Engineer","Ingeniero minero","AG,SC","Los ingenieros mineros se encargan de determinar cómo excavar una mina y cuál es el mejor método para extraer lo que buscan."
289,"Model","Modelo","AG,SC","Los modelos lucen ropa de diseñadores de moda y posan para fotógrafos y otros artistas."
290,"Model Maker","Modelista","AC,AR,MF","Los modelistas crean representaciones realistas, en tres dimensiones, de una enorme variedad de objetos, desde canchas de golf hasta submarinos, rascacielos y zapatos."
291,"Motorcycle Mechanic","Mecánico de motocicletas","AC,AR,MF","Los mecánicos de motocicletas mantienen y reparan motocicletas, así como ciclomotores, motos de nieve y vehículos todo terreno."
292,"Mover","Agente de mudanzas","AC,AR,MF","Los agentes de mudanzas cargan, transportan y descargan las pertenencias de las personas que se mudan de una casa o lugar comercial a otro."
293,"Multimedia Developer","Programador multimedia","AR,IT","Los programadores multimedia crean gráficos, animaciones y otros elementos de videojuegos, sitios web y demás producciones multimedia."
294,"Music Teacher / Instructor","Maestro o profesor de música","AR,ED","Los maestros e instructores de música enseñan a la gente a leerla e interpretarla, y a tocar instrumentos."
295,"Musical Instrument Builder and Repairer","Fabricante y reparador de instrumentos musicales","AR,ED","Los fabricantes y reparadores de instrumentos musicales crean y reparan todo tipo de instrumentos musicales, incluidos pianos, violines y guitarras."
296,"Musician","Músico","AR","Los músicos tocan uno o más instrumentos para entretener al público como integrantes de una orquesta, banda u otro grupo musical."
297,"Nanny","Niñero","AR","Los niñeros cuidan niños en las casas de los clientes."
298,"Federal Agent","Agente federal","AR","Los agentes federales protegen nuestro país y su población en el rol de miembros de departamentos de seguridad del estado, como el FBI y la CIA."
299,"Naturopath","Médico naturista","HE","Los médicos naturistas buscan las causas subyacentes de los problemas médicos y utilizan remedios y terapias naturales para recuperar la salud de las personas."
300,"Enlisted Member of the Armed Forces","Miembro alistado de las Fuerzas Armadas","HE","Los alistados de las Fuerzas Armadas llevan a cabo los pedidos de oficiales en el Ejército, la Marina, la Aviación y la Infantería de Marina."
